{
  "schemaVersion": "1.0.0",
  "dtcId": "dtc-0001",
  "sicFingerprint": "53b9d0db6c3aef2f1e9dda2693214f73b042dfa88389cb62aff0fffb7c501b11",
  "status": "draft",
  "bodyFingerprint": "a89bd37802b1d717e47f590a06c939e63349ae16b726926e5040b92bdff125a0",
  "proposedAt": "2026-07-18T09:30:00Z",
  "byWhom": {
    "identity": "agent:claude-sonnet-5",
    "role": "worker"
  }
}
